{
 "versao": 1,
 "objeto": "industrial_bake_o_matic",
 "sprite": "appliances_cooking_01_65",
 "decisao": "portar",
 "motivo": "forno/salamandra industrial de aço inoxidável com cúpula superior e gabinete bem definidos em 3D, geometria existente no jogo e direções completas",
 "o_que_e": "forno ou salamandra industrial de aço inoxidável com cúpula superior móvel acionada por alavanca tubular frontal, câmara aberta de cozimento com grelha de ripas e gabinete inferior elevado sobre 4 pés metálicos",
 "pecas": [
  {
   "nome": "gabinete_inferior",
   "forma": "caixa",
   "origem": "jogo",
   "material": "metal",
   "descricao": "gabinete base de aço inoxidável ~100x74 cm e ~70 cm de altura (elevado do piso de z~16 cm até z=86 cm), com cuba rebaixada no topo para a grelha"
  },
  {
   "nome": "cupula_superior",
   "forma": "caixa",
   "origem": "jogo",
   "material": "metal",
   "descricao": "cúpula/capô superior móvel em aço inoxidável ~100x62x76 cm (de z=1,39 a 2,15 m), com teto plano e aba inferior sobre a câmara"
  },
  {
   "nome": "coluna_traseira",
   "forma": "caixa",
   "origem": "jogo",
   "material": "metal",
   "descricao": "coluna/painel estrutural vertical traseiro ~100x17 cm e 160 cm de altura (de z=0 a 1,60 m), ligando a base à cúpula e fechando o fundo da câmara"
  },
  {
   "nome": "barra_alavanca",
   "forma": "caixa",
   "origem": "jogo",
   "material": "metal",
   "descricao": "armação tubular articulada em estribo ~100 cm de largura contornando a cúpula superior, inclinada a ~20° para a frente"
  },
  {
   "nome": "pe_frontal",
   "forma": "cilindro",
   "origem": "nova",
   "quantidade": 2,
   "material": "metal",
   "descricao": "dois pés retos tubulares metálicos de ~5 cm de diâmetro e ~16 cm de altura nos cantos frontais inferiores"
  },
  {
   "nome": "pe_traseiro",
   "forma": "cilindro",
   "origem": "simetria",
   "quantidade": 2,
   "material": "metal",
   "descricao": "dois pés retos traseiros tubulares de ~5 cm de diâmetro e ~16 cm de altura, espelho dos pés frontais"
  },
  {
   "nome": "grelha",
   "forma": "caixa",
   "origem": "nova",
   "material": "metal",
   "descricao": "grelha horizontal de cozimento ~85x55 cm com ripas paralelas, assentada na cuba do gabinete inferior na cavidade aberta"
  },
  {
   "nome": "manipulo_alavanca",
   "forma": "cilindro",
   "origem": "nova",
   "material": "liso",
   "descricao": "manípulo/puxador cilíndrico preto de ~6 cm no centro da barra frontal para acionamento manual da cúpula"
  },
  {
   "nome": "pivo_articulacao",
   "forma": "cilindro",
   "origem": "nova",
   "quantidade": 2,
   "material": "metal",
   "descricao": "dois pivôs/mancais circulares salientes nas laterais da coluna traseira onde a barra de alavanca é articulada"
  },
  {
   "nome": "tubo_traseiro",
   "forma": "cilindro",
   "origem": "nova",
   "material": "metal",
   "descricao": "cano/tubo vertical cilíndrico de metal escuro ~6 cm de diâmetro na face traseira descendo pela lateral até o piso"
  },
  {
   "nome": "gaveta_coletora",
   "forma": "caixa",
   "origem": "nova",
   "material": "metal",
   "descricao": "fenda/gaveta coletora horizontal rebaixada ~75x8 cm na face frontal do gabinete inferior"
  }
 ],
 "simetria": "nenhuma",
 "tras": "N",
 "direcoes_espelhadas": true,
 "arte": "adesivo",
 "materiais": {
  "metal": "metal",
  "liso": "liso"
 },
 "problemas_previstos": [
  "FALSO POSITIVO no script: medidas.json sugere espelhar forma_3 (coluna traseira) em y na frente; a coluna existe apenas na traseira estrutural e espelhar na frente fecharia a câmara aberta de cozimento. Não duplicar.",
  "FALSO POSITIVO no script: medidas.json sugere espelhar forma_1 (barra de alavanca) em y na traseira; a barra serve para acionamento frontal pelo operador e não existe repetida atrás. Não duplicar.",
  "Vão livre inferior dos pés: forma_0 no jogo vai até o chão (z=0 a 0,86 m), mas no desenho o gabinete fica suspenso a ~16 cm sobre 4 pés metálicos; recortar a base do corpo e modelar os pés para evitar bloco sólido até o piso.",
  "Cavidade aberta central: manter o vão entre o gabinete inferior (z=0,86 m) e a cúpula (z=1,39 m) aberto na frente e nas laterais, com a grelha horizontal visível internamente.",
  "Grelha de cozimento: ripas paralelas metálicas finas; simplificar com caixa texturizada ou ripas baixas para evitar geometria excessivamente fina ou ruído visual.",
  "Barra da alavanca: no jogo é uma caixa maciça inclinada (forma_1), mas no desenho é uma armação tubular contornando a cúpula; cuidar para manter espessura visível sem colidir com a cúpula.",
  "Detalhes traseiros (direção N): a face traseira possui desenho próprio com venezianas de ventilação e tubo vertical escuro saliente (tubo_traseiro); usar tras = N para aplicar a textura correta.",
  "Simetria lateral e direções espelhadas: E e W são espelhos de S e N (direcoes_espelhadas: true); o tubo vertical traseiro quebra a simetria global (simetria: nenhuma)."
 ],
 "medidas": {
  "sprite": "appliances_cooking_01_65",
  "sprites": {
   "S": "appliances_cooking_01_65",
   "E": "appliances_cooking_01_64",
   "N": "appliances_cooking_01_67",
   "W": "appliances_cooking_01_66"
  },
  "tem_quadro_S": true,
  "n_formas_jogo": 4,
  "formas_ignoradas": [],
  "tem_geometria": true,
  "n_formas": 4,
  "tipos": {
   "caixa": 4,
   "cilindro": 0,
   "prisma": 0
  },
  "pecas": [
   {
    "nome": "forma_0",
    "forma": "caixa",
    "min": [
     -0.5135,
     -0.3217,
     0.0
    ],
    "max": [
     0.4865,
     0.4193,
     0.8575
    ]
   },
   {
    "nome": "forma_1",
    "forma": "caixa",
    "min": [
     -0.0436,
     -0.8732,
     1.661
    ],
    "max": [
     0.0292,
     0.1268,
     2.0942
    ],
    "rot": [
     0.0,
     20.0,
     -89.98
    ]
   },
   {
    "nome": "forma_2",
    "forma": "caixa",
    "min": [
     -0.5135,
     -0.3217,
     1.394
    ],
    "max": [
     0.4865,
     0.2999,
     2.1529
    ]
   },
   {
    "nome": "forma_3",
    "forma": "caixa",
    "min": [
     -0.5136,
     0.2523,
     0.0
    ],
    "max": [
     0.4864,
     0.4193,
     1.6028
    ]
   }
  ],
  "multi_tile": false,
  "material": "metal",
  "material_props": {
   "Material": "Electric",
   "Material2": "MetalPlates",
   "Material3": "MetalScrap",
   "MaterialType": "Metal_Large"
  },
  "props": {
   "CustomName": "Industrial",
   "GroupName": "Bake-O-Matic",
   "Facing": "S",
   "IsMoveAble": "",
   "BlocksPlacement": "",
   "solidtrans": "",
   "ScrapSize": "Large",
   "PickUpWeight": "400"
  },
  "props_geometria": {
   "ItemHeight": "85",
   "Translucent": "true"
  },
  "categoria": "eletrodomesticos",
  "caixa": {
   "min": [
    -0.5136,
    -0.4817,
    0.0
   ],
   "max": [
    0.4928,
    0.4193,
    2.1529
   ],
   "largura": 1.0064,
   "profundidade": 0.901,
   "altura": 2.1529
  },
  "menor_medida_peca": 0.167,
  "fino": false,
  "pecas_finas": [],
  "altura_base": 0.0,
  "montado_na_parede": false,
  "contorno_0": 0.9237,
  "cobertura": 0.9984,
  "sobra": 0.0749,
  "pixels_desenho": 19050,
  "pixels_geometria": 20558,
  "espelhado_E_S": 0.8523,
  "espelhado_W_N": 0.8682,
  "N_igual_S": 0.7121,
  "silhueta_espelho_E_S": 0.9489,
  "silhueta_espelho_W_N": 0.9444,
  "E_e_espelho_de_S": true,
  "W_e_espelho_de_N": true,
  "tem_N": true,
  "centro_simetria": [
   -0.0104,
   -0.0312
  ],
  "pecas_sem_par": [
   {
    "peca": "forma_0",
    "sem_par": [
     "y",
     "xy"
    ]
   },
   {
    "peca": "forma_1",
    "sem_par": [
     "y",
     "xy"
    ]
   },
   {
    "peca": "forma_2",
    "sem_par": [
     "y",
     "xy"
    ]
   },
   {
    "peca": "forma_3",
    "sem_par": [
     "y",
     "xy"
    ]
   }
  ],
  "pecas_provavelmente_faltando": [
   {
    "forma": "caixa",
    "copia_de": "forma_1",
    "espelho": "y",
    "votos": 2,
    "pe": false,
    "min": [
     -0.5072,
     0.2024,
     1.6616
    ],
    "max": [
     0.4928,
     0.4193,
     2.0936
    ]
   },
   {
    "forma": "caixa",
    "copia_de": "forma_3",
    "espelho": "y",
    "votos": 2,
    "pe": false,
    "min": [
     -0.5136,
     -0.4817,
     0.0
    ],
    "max": [
     0.4864,
     -0.3147,
     1.6028
    ]
   }
  ],
  "n_pes": 0,
  "profundidade": {
   "existe": true,
   "pixels": 20335,
   "cobertura": 0.9995,
   "fora_do_desenho": 0.0637
  },
  "sugestao": [
   "E é o espelho de S",
   "W é o espelho de N",
   "E/W são só espelhos: bastam S e N",
   "há desenho de trás real (N): usar tras = N"
  ],
  "pasta": "C:\\Users\\micro\\Desktop\\ProjectZomboid-FirstPerson-Suite\\05-Model-3D-Extractor-MCP\\acervo\\data\\porte3d\\inspecao\\industrial_bake_o_matic",
  "imagens": {
   "direcoes.png": "C:\\Users\\micro\\Desktop\\ProjectZomboid-FirstPerson-Suite\\05-Model-3D-Extractor-MCP\\acervo\\data\\porte3d\\inspecao\\industrial_bake_o_matic\\direcoes.png",
   "geometria.png": "C:\\Users\\micro\\Desktop\\ProjectZomboid-FirstPerson-Suite\\05-Model-3D-Extractor-MCP\\acervo\\data\\porte3d\\inspecao\\industrial_bake_o_matic\\geometria.png",
   "cobertura.png": "C:\\Users\\micro\\Desktop\\ProjectZomboid-FirstPerson-Suite\\05-Model-3D-Extractor-MCP\\acervo\\data\\porte3d\\inspecao\\industrial_bake_o_matic\\cobertura.png",
   "profundidade.png": "C:\\Users\\micro\\Desktop\\ProjectZomboid-FirstPerson-Suite\\05-Model-3D-Extractor-MCP\\acervo\\data\\porte3d\\inspecao\\industrial_bake_o_matic\\profundidade.png"
  }
 }
}
